{
  "schema_version": "1.0",
  "source_paths": ["greeting.py"],
  "test_paths": ["test_greeting.py"],
  "commands": {"tests": ["python3", "-B", "-m", "unittest", "-v", "test_greeting"]},
  "test_command": "tests",
  "test_format": "unittest",
  "image": "sha256:0000000000000000000000000000000000000000000000000000000000000000",
  "max_turns": 20,
  "max_output_bytes": 200000,
  "command_timeout": 60
}
